title,kicker,image,link,word_count,char_count,capital_words
Station Casinos to soft open its new tavern brand with Seventy-Six opening on 10 October,NORTH LAS VEGAS,https://imagenesyogonet.b-cdn.net/data/imagenes/2024/09/30/68394/1727700241-station-casino-tavern-render-sep-2024.jpg,https://www.yogonet.com/international/noticias/2024/09/30/80369-station-casinos-to-soft-open-its-new-tavern-brand-with-seventysix-opening-on-10-october,15,88,"['Station', 'Casinos', 'Seventy-Six', 'October']"
"Sporttrade app goes live in Arizona, its fourth state in the US",AVAILABLE VIA IOS AND ANDROID,https://imagenesyogonet.b-cdn.net/data/imagenes/2024/09/27/68360/1727442446-sporttrade-app-arizona.jpg,https://www.yogonet.com/international/noticias/2024/09/30/80069-sporttrade-app-goes-live-in-arizona-its-fourth-state-in-the-us,12,63,"['Sporttrade', 'Arizona,', 'US']"
Indian Gaming Association provides legislative updates at New Mexico Gaming Tribes meeting,$41.9BN INDIAN GAMING REVENUES IN 2023,https://imagenesyogonet.b-cdn.net/data/imagenes/2024/09/30/68403/1727704323-indian-gaming-ass-meets-coalition-new-mexico-gaming-tribe.jpg,https://www.yogonet.com/international/noticias/2024/09/30/80371-indian-gaming-association-provides-legislative-updates-at-new-mexico-gaming-tribes-meeting,12,90,"['Indian', 'Gaming', 'Association', 'New', 'Mexico', 'Gaming', 'Tribes']"
DRGT to debut new products at G2E under guidance of new CEO Marco Herrera,AT BOOTH 4405,https://imagenesyogonet.b-cdn.net/data/imagenes/2024/02/08/61466/1707396041-ice-london-2024-2-44-stand-drgt.jpg,https://www.yogonet.com/international/noticias/2024/09/30/80370-drgt-to-debut-new-products-at-g2e-under-guidance-of-new-ceo-marco-herrera,14,73,"['DRGT', 'G2E', 'CEO', 'Marco', 'Herrera']"
Appeals Court hears dispute between native tribes over casino on sacred Alabama land,TRIBAL DISPUTE,https://imagenesyogonet.b-cdn.net/data/imagenes/2024/09/30/68390/1727699277-members-muscogee-nation-outside-court-atlanta-sep-2024.jpg,https://www.yogonet.com/international/noticias/2024/09/30/80089-appeals-court-hears-dispute-between-native-tribes-over-casino-on-sacred-alabama-land,13,84,"['Appeals', 'Court', 'Alabama']"
"SBC Awards reveals list of 2024 winners; Soft2Bet, Betsson and Kaizen Gaming among standout winners",TOOK PLACE ON SEPT 26TH,https://imagenesyogonet.b-cdn.net/data/imagenes/2024/09/30/68391/1727699571-sbc-awards-ganadores-septiembre-2024.jpg,https://www.yogonet.com/international/news/2024/09/30/80374-sbc-awards-reveals-list-of-2024-winners-soft2bet-betsson-and-kaizen-gaming-among-standout-winners,15,99,"['SBC', 'Awards', 'Soft2Bet,', 'Betsson', 'Kaizen', 'Gaming']"
FBM to showcase 24 casino games split across six different product lines at G2E Las Vegas,"OCTOBER 8-10, BOOTH 2848",https://imagenesyogonet.b-cdn.net/data/imagenes/2024/09/26/68259/1727357996-fbm-g2e-2024.jpg,https://www.yogonet.com/international/noticias/2024/09/29/80066-fbm-to-showcase-24-casino-games-split-across-six-different-product-lines-at-g2e-las-vegas,16,89,"['FBM', 'G2E', 'Las', 'Vegas']"
Hard Rock Casino Las Vegas and Guitar Hotel officials take off-site offices near Summerlin,CASINO SET TO OPEN IN 2027,https://imagenesyogonet.b-cdn.net/data/imagenes/2022/12/07/51006/1670459916-hard-rock-las-vegas-the-mirage-render2.jpg,https://www.yogonet.com/international/noticias/2024/09/30/80082-hard-rock-casino-las-vegas-and-guitar-hotel-officials-take-offsite-offices-near-summerlin,14,90,"['Hard', 'Rock', 'Casino', 'Las', 'Vegas', 'Guitar', 'Hotel', 'Summerlin']"
Arkansas Secretary of State asks Supreme Court not to count casino amendment votes,CHALLENGES LEGALITY OF SIGNATURES,https://imagenesyogonet.b-cdn.net/data/imagenes/2024/09/27/68363/1727448576-john-thurston-secretary-state-arkansas.jpg,https://www.yogonet.com/international/noticias/2024/09/29/80079-arkansas-secretary-of-state-asks-supreme-court-not-to-count-casino-amendment-votes,13,82,"['Arkansas', 'Secretary', 'State', 'Supreme', 'Court']"
Texas Lottery wins two awards at NASPL Conference,EIGHT ADDITIONAL CATEGORIES,https://imagenesyogonet.b-cdn.net/data/imagenes/2024/03/25/62884/1711389644-texas-lottery-lucky-7-scratch-ticket-game-march-2024.jpg,https://www.yogonet.com/international/noticias/2024/09/30/80090-texas-lottery-wins-two-awards-at-naspl-conference,8,49,"['Texas', 'Lottery', 'NASPL', 'Conference']"
Sands China opens revamped Londoner Grand Casino ahead of Golden Week,PART OF COMPANY’S $1.2BN INVESTMENT PLAN,https://imagenesyogonet.b-cdn.net/data/imagenes/2024/09/30/68402/1727704268-sands-china-macau-grand-londoner-exterior.jpg,https://www.yogonet.com/international/noticias/2024/09/30/80375-sands-china-opens-revamped-londoner-grand-casino-ahead-of-golden-week,11,69,"['Sands', 'China', 'Londoner', 'Grand', 'Casino', 'Golden', 'Week']"
"1xBet successfully showcased gaming platform, affiliate program as premium sponsor of SBC Summit",SEPTEMBER 24TH-26TH,https://imagenesyogonet.b-cdn.net/data/imagenes/2024/09/30/68395/1727700514-1xbet-stand-sbc-summit-2024.jpg,https://www.yogonet.com/international/noticias/2024/09/30/80368-1xbet-successfully-showcased-gaming-platform-affiliate-program-as-premium-sponsor-of-sbc-summit,13,96,"['SBC', 'Summit']"
"Hard Rock International launches PINKTOBER campaign with $100k donation, auctions, global activation",BREAST CANCER AWARENESS,https://imagenesyogonet.b-cdn.net/data/imagenes/2024/09/27/68368/1727449369-hard-rock-casinos-breast-cancer-fight-pinktober-02.jpg,https://www.yogonet.com/international/noticias/2024/09/29/80102-hard-rock-international-launches-pinktober-campaign-with-100k-donation-auctions-global-activation,12,100,"['Hard', 'Rock', 'International', 'PINKTOBER']"
"NIGC Compliance Officer Jo'Elle Thompson named to ELG ""40 Under 40"" Class of 2025",MEMBER OF SENECA NATION OF INDIANS,https://imagenesyogonet.b-cdn.net/data/imagenes/2024/09/27/68379/1727459005-nigc-compliance-officer-jo-elle-thompson.jpg,https://www.yogonet.com/international/noticias/2024/09/29/80099-nigc-compliance-officer-jo-39elle-thompson-named-to-elg-3440-under-40-34-class-of-2025,14,81,"['NIGC', 'Compliance', 'Officer', ""Jo'Elle"", 'Thompson', 'ELG', 'Under', 'Class']"
The European Lotteries announces Greenhouse Gas Emissions Reduction Programme to lower carbon footprint,SUSTAINABLE PRACTICES ADOPTED,https://imagenesyogonet.b-cdn.net/data/imagenes/2024/09/30/68389/1727698920-european-lotteries-seminario-dublin-sep-2024.jpg,https://www.yogonet.com/international/noticias/2024/09/30/80094-the-european-lotteries-announces-greenhouse-gas-emissions-reduction-programme-to-lower-carbon-footprint,13,103,"['The', 'European', 'Lotteries', 'Greenhouse', 'Gas', 'Emissions', 'Reduction', 'Programme']"
1spin4win launches new Oktoberfest-themed online slot Lucky Fest Hold and Win,"3X3 REEL, 27 PAY LINES",https://imagenesyogonet.b-cdn.net/data/imagenes/2024/09/27/68371/1727449956-1spin4win-lucky-fest-hold-and-win.jpg,https://www.yogonet.com/international/noticias/2024/09/30/80086-1spin4win-launches-new-oktoberfestthemed-online-slot-lucky-fest-hold-and-win,11,77,"['Oktoberfest-themed', 'Lucky', 'Fest', 'Hold', 'Win']"
Missouri sports betting amendment could cut into Kansas gaming revenue,EXPECTS $4.7 MILLION TAX IN FIRST YEAR,https://imagenesyogonet.b-cdn.net/data/imagenes/2023/02/16/52354/1676579958-super-bowl-lvii-kansas-city-philadelphia.jpg,https://www.yogonet.com/international/noticias/2024/09/29/80076-missouri-sports-betting-amendment-could-cut-into-kansas-gaming-revenue,10,70,"['Missouri', 'Kansas']"
"BetMGM sponsors progressive jackpot, brings back free spin in Wheel of Fortune's Big Winners Tournament",PARTNERS WITH VIRAL ANSWER CONTESTANT,https://imagenesyogonet.b-cdn.net/data/imagenes/2024/09/27/68364/1727448577-betmgm-wheel-of-fortune-big-winners-tournament.jpg,https://www.yogonet.com/international/noticias/2024/09/29/80085-betmgm-sponsors-progressive-jackpot-brings-back-free-spin-in-wheel-of-fortune-39s-big-winners-tournament,15,103,"['BetMGM', 'Wheel', ""Fortune's"", 'Big', 'Winners', 'Tournament']"
GiG Media officially rebrands to Gentoo Media after shareholder approval,NAME CHANGE FINALIZED,https://imagenesyogonet.b-cdn.net/data/imagenes/2024/06/18/65385/1718740755-gentoo-generica.jpg,https://www.yogonet.com/international/news/2024/09/27/79984-gig-media-officially-rebrands-to-gentoo-media-after-shareholder-approval,10,72,"['GiG', 'Media', 'Gentoo', 'Media']"
Brazil President Lula calls for speed up regulation on the country's gambling industry at Future Summit in NY,TO CURB DEBT OF THE POOREST,https://imagenesyogonet.b-cdn.net/data/imagenes/2024/09/25/68158/1727270351-luiz-inacio-lula-da-silva-organizacion-naciones-unidas-onu-new-york.jpg,https://www.yogonet.com/international/noticias/2024/09/26/79994-brazil-president-lula-calls-for-speed-up-regulation-on-the-country-39s-gambling-industry-at-future-summit-in-ny,18,109,"['Brazil', 'President', 'Lula', 'Future', 'Summit', 'NY']"
Vegas Golden Knights announce official partnership with Fontainebleau Las Vegas,"INCLUDES SIGNAGE, SPECIAL SCREENINGS",https://imagenesyogonet.b-cdn.net/data/imagenes/2024/09/26/68310/1727366299-fontainebleau-las-vegas-official-partner-vegas-golden-knights.jpg,https://www.yogonet.com/international/noticias/2024/09/27/79977-vegas-golden-knights-announce-official-partnership-with-fontainebleau-las-vegas,10,79,"['Vegas', 'Golden', 'Knights', 'Fontainebleau', 'Las', 'Vegas']"
"Nevada gaming revenue drops 3.8% in August, Las Vegas Strip hit by low table game holds",AUGUST REVENUE STOOD AT $1.16 BILLION,https://imagenesyogonet.b-cdn.net/data/imagenes/2022/08/12/48200/1660317329-vista-las-vegas-22-strip-nevada.jpg,https://www.yogonet.com/international/noticias/2024/09/27/80070-nevada-gaming-revenue-drops-38-in-august-las-vegas-strip-hit-by-low-table-game-holds,16,87,"['Nevada', 'August,', 'Las', 'Vegas', 'Strip']"
SL Benfica signs partnership agreement with 888AFRICA for Mozambique and Angola,OFFICIAL SPORTS BETTING PARTNER,https://imagenesyogonet.b-cdn.net/data/imagenes/2024/09/26/68305/1727364913-acuerdo-sl-benfica-888africa.jpg,https://www.yogonet.com/international/news/2024/09/26/79970-sl-benfica-signs-partnership-agreement-with-888africa-for-mozambique-and-angola,11,79,"['SL', 'Benfica', 'Mozambique', 'Angola']"
North Carolina sports betting revenue surpasses expectations as retail options loom,$62 MILLION IN SPORTS BETTING TAX REVENUE,https://imagenesyogonet.b-cdn.net/data/imagenes/2021/07/23/37792/1627067103-mobile-apuestas-deportivas-generica.jpg,https://www.yogonet.com/international/noticias/2024/09/27/79980-north-carolina-sports-betting-revenue-surpasses-expectations-as-retail-options-loom,11,83,"['North', 'Carolina']"
Tropicana Las Vegas’ implosion to take place on October 9 with over 2K explosives,DRONE AND FIREWORKS SHOW TO PRECEDE,https://imagenesyogonet.b-cdn.net/data/imagenes/2019/05/02/25200/1625326445-tropicana-las-vegas-casino-hotel-resort-01.jpg,https://www.yogonet.com/international/noticias/2024/09/26/79971-tropicana-las-vegas-implosion-to-take-place-on-october-9-with-over-2k-explosives,14,81,"['Tropicana', 'Las', 'Vegas’', 'October']"
"Flutter predicts $21B revenue in 2027, approves up to $5 billion share buyback",SEES $368 BILLION REGULATED TAM BY 2030,https://imagenesyogonet.b-cdn.net/data/imagenes/2023/03/08/52802/1678286821-flutter-generica-03-edificio.jpg,https://www.yogonet.com/international/noticias/2024/09/26/79966-flutter-predicts-21b-revenue-in-2027-approves-up-to-5-billion-share-buyback,13,78,['Flutter']
U.S. gaming industry responsible gaming investments reach new high with $472M in 2023,BASED ON AGA'S LATEST DATA,https://imagenesyogonet.b-cdn.net/data/imagenes/2024/09/27/68358/1727442286-juego-poker-cartas-dealer-generica.jpg,https://www.yogonet.com/international/noticias/2024/09/27/80063-us-gaming-industry-responsible-gaming-investments-reach-new-high-with-472m-in-2023,13,85,['U.S.']
"BetConstruct launches new igaming loyalty system to improve player engagement, retention strategies",'LAST BATTLE',https://imagenesyogonet.b-cdn.net/data/imagenes/2024/09/23/68069/1727093905-betconstruct-the-last-battle-the-new-era-loyalty-game-engagement.jpg,https://www.yogonet.com/international/noticias/2024/09/26/79986-betconstruct-launches-new-igaming-loyalty-system-to-improve-player-engagement-retention-strategies,12,99,['BetConstruct']
Macau: Concerns rise over economic impact on Golden Week despite strong hotel bookings,DAILY GGR EXPECTED TO REACH $112M-$118M,https://imagenesyogonet.b-cdn.net/data/imagenes/2024/09/26/68302/1727364752-macau-golden-week.jpg,https://www.yogonet.com/international/noticias/2024/09/26/79964-macau-concerns-rise-over-economic-impact-on-golden-week-despite-strong-hotel-bookings,13,86,"['Macau:', 'Concerns', 'Golden', 'Week']"
"Star Entertainment posts $1.16 billion annual loss, considers asset sales amid regulatory and economic pressure",AUSTRALIA'S SECOND-LARGEST CASINO OPERATOR,https://imagenesyogonet.b-cdn.net/data/imagenes/2023/11/24/59859/1700848738-the-star-sydney-australia-08.jpg,https://www.yogonet.com/international/noticias/2024/09/27/79989-star-entertainment-posts-116-billion-annual-loss-considers-asset-sales-amid-regulatory-and-economic-pressure,15,111,"['Star', 'Entertainment']"
IGT renews FanDuel retail sports betting platform agreement through 2028,EXPANDED BY FOUR ADDITIONAL YEARS,https://imagenesyogonet.b-cdn.net/data/imagenes/2021/09/21/39301/1633371932-fanduel-sportsbook-footprint-center-phoenix-suns-arizona-03.jpg,https://www.yogonet.com/international/noticias/2024/09/27/80048-igt-renews-fanduel-retail-sports-betting-platform-agreement-through-2028,10,72,"['IGT', 'FanDuel']"
Sorare to face court over unlicensed gambling charges in the UK,HEARING ON 4 OCTOBER,https://imagenesyogonet.b-cdn.net/data/imagenes/2022/09/21/49112/1663774055-ukgc-generica-04-gambling-commission.jpg,https://www.yogonet.com/international/noticias/2024/09/27/80073-sorare-to-face-court-over-unlicensed-gambling-charges-in-the-uk,11,63,"['Sorare', 'UK']"
Play’n GO announces new adventure slot Kingdom Below,5X4 GRID SLOT,https://imagenesyogonet.b-cdn.net/data/imagenes/2024/09/26/68301/1727364669-play-n-go-kingdom-below.jpg,https://www.yogonet.com/international/noticias/2024/09/27/79990-playn-go-announces-new-adventure-slot-kingdom-below,8,52,"['Play’n', 'GO', 'Kingdom', 'Below']"
Zitro introduces Fu Frog to Huelva’s Recreativos Babi amid Spain expansion,IN THE SALAS POKER ARCADE,https://imagenesyogonet.b-cdn.net/data/imagenes/2024/09/26/68346/1727374498-zitro-fu-frog-salas-poker-andalucia-spain.jpg,https://www.yogonet.com/international/noticias/2024/09/26/79985-zitro-introduces-fu-frog-to-huelvas-recreativos-babi-amid-spain-expansion,11,74,"['Zitro', 'Fu', 'Frog', 'Huelva’s', 'Recreativos', 'Babi', 'Spain']"
"Playtech, MGM execs speak on collaboration to broadcast live casino titles from MGM's Vegas resorts",No disponible,https://imagenesyogonet.b-cdn.net/data/imagenes/2024/09/26/68294/1727364503-sbc-summit-lisbon-2024-77-shimon-akad-playtech.jpg,https://www.yogonet.com/international/noticias/2024/09/30/79993-playtech-mgm-execs-speak-on-collaboration-to-broadcast-live-casino-titles-from-mgm-39s-vegas-resorts,15,99,"['Playtech,', 'MGM', ""MGM's"", 'Vegas']"
"Playtech posts 11% rise in adjusted EBITDA for H1 2024, driven by B2B expansion",No disponible,https://imagenesyogonet.b-cdn.net/data/imagenes/2021/11/08/40361/1636378621-playtech-oficina-cartel.jpg,https://www.yogonet.com/international/noticias/2024/09/30/80387-playtech-posts-11-rise-in-adjusted-ebitda-for-h1-2024-driven-by-b2b-expansion,14,79,"['Playtech', 'EBITDA', 'H1', 'B2B']"
"Macau International Airport opens Sands, Galaxy and MGM China luxury lounges",No disponible,https://imagenesyogonet.b-cdn.net/data/imagenes/2024/09/30/68409/1727718571-sands-galaxy-mgm-lounge-macau-airport.jpg,https://www.yogonet.com/international/news/2024/09/30/80391-macau-international-airport-opens-sands-galaxy-and-mgm-china-luxury-lounges,11,76,"['Macau', 'International', 'Airport', 'Sands,', 'Galaxy', 'MGM', 'China']"
Flutter Entertainment predicts U.S. online gambling market will surge past $60B by 2030,No disponible,https://imagenesyogonet.b-cdn.net/data/imagenes/2024/09/26/68244/1727355749-flutter-nyse.jpg,https://www.yogonet.com/international/noticias/2024/09/26/79958-flutter-entertainment-predicts-us-online-gambling-market-will-surge-past-60b-by-2030,13,87,"['Flutter', 'Entertainment', 'U.S.']"
Connecticut: Foxwoods Resort Casino unveils new Grand Bar,FEATURING SPECIALTY COCKTAILS AND SPIRITS,https://imagenesyogonet.b-cdn.net/data/imagenes/2024/09/30/68407/1727718148-foxwoods-opens-new-grand-bar.jpg,https://www.yogonet.com/international/news/2024/09/30/80380-connecticut-foxwoods-resort-casino-unveils-new-grand-bar,8,57,"['Connecticut:', 'Foxwoods', 'Resort', 'Casino', 'Grand', 'Bar']"
Wynn Las Vegas ranks 8th highest in the country with friendliest staff in latest casino survey,ONLINE UNITED STATES CASINOS SURVEY,https://imagenesyogonet.b-cdn.net/data/imagenes/2020/08/28/32710/1625356563-wynn-encore-vegas-02.jpg,https://www.yogonet.com/international/noticias/2024/09/26/79983-wynn-las-vegas-ranks-8th-highest-in-the-country-with-friendliest-staff-in-latest-casino-survey,16,94,"['Wynn', 'Las', 'Vegas']"
Norfolk Casino moves one step closer to completion as Architectural Review Board approves the project,AMID DESIGN CONCERNS,https://imagenesyogonet.b-cdn.net/data/imagenes/2021/04/22/36155/1625370362-pamunkey-indian-tribe-norfolk-casino-richmond-proyecto-01.jpg,https://www.yogonet.com/international/noticias/2024/09/26/79961-norfolk-casino-moves-one-step-closer-to-completion-as-architectural-review-board-approves-the-project,15,101,"['Norfolk', 'Casino', 'Architectural', 'Review', 'Board']"
"Toronto: Great Canadian Casino Resort introduces new high-limit slots, table games rooms for VIP guests",FEATURES 26 LIVE TABLES,https://imagenesyogonet.b-cdn.net/data/imagenes/2024/09/25/68188/1727281378-great-canadian-resort-toronto-new-high-limit-slot-room.jpg,https://www.yogonet.com/international/noticias/2024/09/25/79870-toronto-great-canadian-casino-resort-introduces-new-highlimit-slots-table-games-rooms-for-vip-guests,15,103,"['Toronto:', 'Great', 'Canadian', 'Casino', 'Resort', 'VIP']"
Underdog Fantasy ranks No. 15 on LinkedIn’s Top Startups list,SECOND CONSECUTIVE YEAR,https://imagenesyogonet.b-cdn.net/data/imagenes/2022/07/27/47745/1658950979-underdog-fantasy-sports-laptop-mobile-app.jpg,https://www.yogonet.com/international/noticias/2024/09/26/79960-underdog-fantasy-ranks-no-15-on-linkedins-top-startups-list,10,61,"['Underdog', 'Fantasy', 'No.', 'LinkedIn’s', 'Top', 'Startups']"
Louisiana mobile and retail sports betting handle hits $234.5M in August,REVENUE UP 49.5% YEAR-OVER-YEAR,https://imagenesyogonet.b-cdn.net/data/imagenes/2018/12/20/22967/1625254505-sportsbetting-generica-mandalaybay-casino.jpg,https://www.yogonet.com/international/noticias/2024/09/25/79878-louisiana-mobile-and-retail-sports-betting-handle-hits-2345m-in-august,11,72,"['Louisiana', 'August']"
SI Sportsbook becomes latest operator to exit Colorado sports betting market as national expansion stalls,SEVENTH PLATFORM TO WITHDRAW FROM STATE,https://imagenesyogonet.b-cdn.net/data/imagenes/2021/07/23/37792/1627067103-mobile-apuestas-deportivas-generica.jpg,https://www.yogonet.com/international/noticias/2024/09/25/79752-si-sportsbook-becomes-latest-operator-to-exit-colorado-sports-betting-market-as-national-expansion-stalls,15,105,"['SI', 'Sportsbook', 'Colorado']"
ESPN Bet set to launch as New York regulator approves $25 million licensing deal,LICENSE TRANSFER FROM WYNN RESORTS,https://imagenesyogonet.b-cdn.net/data/imagenes/2023/10/18/58763/1697654719-logo-espn-bet.jpg,https://www.yogonet.com/international/noticias/2024/09/24/79744-espn-bet-set-to-launch-as-new-york-regulator-approves-25-million-licensing-deal,14,80,"['ESPN', 'Bet', 'New', 'York']"
Boyd Gaming acquires Resorts Digital in latest iGaming expansion,No disponible,https://imagenesyogonet.b-cdn.net/data/imagenes/2020/06/09/31542/1625351884-resorts-casino-hotel-atlantic-city.jpg,https://www.yogonet.com/international/noticias/2024/09/24/79736-boyd-gaming-acquires-resorts-digital-in-latest-igaming-expansion,9,64,"['Boyd', 'Gaming', 'Resorts', 'Digital']"
How to survive a crisis? Slotegrator’s tips on business continuity and disaster recovery,No disponible,https://imagenesyogonet.b-cdn.net/data/imagenes/2024/09/20/68029/1726839522-slotegrator-business-continuity-disaster-recovery-igaming-ebook.jpg,https://www.yogonet.com/international/noticias/2024/09/23/79332-how-to-survive-a-crisis-slotegrators-tips-on-business-continuity-and-disaster-recovery,13,88,"['How', 'Slotegrator’s']"
The role of payment solutions in driving conversion in iGaming,No disponible,https://imagenesyogonet.b-cdn.net/data/imagenes/2024/09/23/68079/1727100788-uplatform-role-payment-solutions-driving-conversion-igaming-01.jpg,https://www.yogonet.com/international/noticias/2024/09/23/79643-the-role-of-payment-solutions-in-driving-conversion-in-igaming,10,62,['The']
Slotegrator: New tech and omnichannel approach are the keys to Eastern Europe,No disponible,https://imagenesyogonet.b-cdn.net/data/imagenes/2024/09/05/67544/1725543993-slotegrator-eastern-european-markets-are-on-the-rise.jpg,https://www.yogonet.com/international/noticias/2024/09/05/77729-slotegrator-new-tech-and-omnichannel-approach-are-the-keys-to-eastern-europe,12,77,"['Slotegrator:', 'New', 'Eastern', 'Europe']"
New Jersey moves to ban college sports betting partnerships with key exceptions,ASSEMBLY COMMITTEE PASSES BILL A4113,https://imagenesyogonet.b-cdn.net/data/imagenes/2021/11/04/40311/1636035062-new-jersey-college-football.jpg,https://www.yogonet.com/international/noticias/2024/09/25/79848-new-jersey-moves-to-ban-college-sports-betting-partnerships-with-key-exceptions,12,79,"['New', 'Jersey']"
Dutch government faces backlash over phased gambling tax hike,TAX RATE TO BE RAISED TO 37.8%,https://imagenesyogonet.b-cdn.net/data/imagenes/2019/06/19/26075/1625329981-juego-online-paises-bajos-generica.jpg,https://www.yogonet.com/international/noticias/2024/09/24/79749-dutch-government-faces-backlash-over-phased-gambling-tax-hike,9,61,['Dutch']
Denmark set to propose liberalized bingo and lottery bill in October,TO STREAMLINE CHARITY LOTTERY,https://imagenesyogonet.b-cdn.net/data/imagenes/2023/08/30/57186/1693401909-spillemyndigheden-danish-gambling-authority.jpg,https://www.yogonet.com/international/noticias/2024/09/23/79655-denmark-set-to-propose-liberalized-bingo-and-lottery-bill-in-october,11,68,"['Denmark', 'October']"
Latvia seeks to tighten regulations by raising gambling age limit to 21,AGE LIMIT OF 18 FOR LOTTERIES,https://imagenesyogonet.b-cdn.net/data/imagenes/2020/12/23/34480/1625363643-vista-riga-latvia.jpg,https://www.yogonet.com/international/noticias/2024/09/23/79649-latvia-seeks-to-tighten-regulations-by-raising-gambling-age-limit-to-21,12,71,['Latvia']
"Asojuegos: ""Imposing VAT on online gaming would generate a massive migration to illegal platforms""","JUAN CARLOS RESTREPO ESCOBAR, PRESIDENT",https://imagenesyogonet.b-cdn.net/data/imagenes/2020/01/24/29917/1625345343-juan-carlos-restrepo-asojuegos-03.jpg,https://www.yogonet.com/international/noticias/2024/09/24/79747-asojuegos-34imposing-vat-on-online-gaming-would-generate-a-massive-migration-to-illegal-platforms-34,14,98,"['Asojuegos:', 'VAT']"
"""This year's GAT Santo Domingo was consolidated as a central event in the Caribbean region""",INTERVIEW WITH JOSÉ ANÍBAL AGUIRRE,https://imagenesyogonet.b-cdn.net/data/imagenes/2024/09/19/67947/1726749258-gat-showcase-santo-domingo-2024-11-conferencias-jose-aguirre.jpg,https://www.yogonet.com/international/noticias/2024/09/23/79625--34this-year-39s-gat-santo-domingo-was-consolidated-as-a-central-event-in-the-caribbean-region-34,15,91,"['GAT', 'Santo', 'Domingo', 'Caribbean']"
"""Uplatform is a prominent player in the European market, distinguished by its strong reputation and significant presence""","MARIA ISMAILYAN, SENIOR SALES MANAGER",https://imagenesyogonet.b-cdn.net/data/imagenes/2024/09/19/67999/1726770173-uplatform-maria-ismailyan-interview-yogonet.jpg,https://www.yogonet.com/international/noticias/2024/09/23/79242--34uplatform-is-a-prominent-player-in-the-european-market-distinguished-by-its-strong-reputation-and-significant-presence-34,17,121,['European']
"BetBoom: ""Latin America is a key strategic direction for us and Brazil holds a central place in this strategy""",COMPANY SOON TO EXPAND INTO BRAZIL,https://imagenesyogonet.b-cdn.net/data/imagenes/2024/04/26/63887/1714160008-bis-sigma-americas-2024-106-stand-betboom.jpg,https://www.yogonet.com/international/noticias/2024/09/23/79134-betboom-34latin-america-is-a-key-strategic-direction-for-us-and-brazil-holds-a-central-place-in-this-strategy-34,19,110,"['BetBoom:', 'America', 'Brazil']"
Flutter Entertainment and MGM CEOs to deliver keynote at G2E Las Vegas,No disponible,https://imagenesyogonet.b-cdn.net/data/imagenes/2024/09/25/68178/1727275751-bill-hornbuckle-mgm-peter-jackson-flutter.jpg,https://www.yogonet.com/international/noticias/2024/09/25/79851-flutter-entertainment-and-mgm-ceos-to-deliver-keynote-at-g2e-las-vegas,12,70,"['Flutter', 'Entertainment', 'MGM', 'CEOs', 'G2E', 'Las', 'Vegas']"
BetBlocker to launch Portuguese language support service at SBC Summit 2024,No disponible,https://imagenesyogonet.b-cdn.net/data/imagenes/2024/09/25/68184/1727276467-betblocker-sbc-summit-lisboa-2024-portugal.jpg,https://www.yogonet.com/international/noticias/2024/09/25/79864-betblocker-to-launch-portuguese-language-support-service-at-sbc-summit-2024,11,75,"['BetBlocker', 'Portuguese', 'SBC', 'Summit']"
